{
  "schemaVersion": 1,
  "id": "github-issue-resolver",
  "name": "GitHub Issue Resolver",
  "publisher": "SkillzForest",
  "category": "development",
  "subcategory": "code",
  "version": "0.3.0",
  "license": "MIT",
  "description": "Turn GitHub Issues into reviewed fixes in Claude Code: installs the GitHub CLI if needed, gathers each issue's full context — text, comments, screenshots, attachments — one at a time or for a whole Project board at once, then investigates, reproduces and implements the minimal fix, and links the pushed commit or pull request back on the issue.",
  "tags": [
    "github",
    "issues",
    "claude-code",
    "bugfix"
  ],
  "skills": [
    "skf-github-issue-brief",
    "skf-github-issue-fix"
  ],
  "ordered": true
}
