{
  "schemaVersion": 1,
  "id": "seo-factory",
  "name": "SEO Factory",
  "publisher": "SkillzForest",
  "category": "marketing",
  "subcategory": "seo-sea",
  "version": "0.3.0",
  "license": "MIT",
  "description": "Continuous SEO for any website or SaaS: describe the site once, connect Search Console, Google Trends and a mailbox, audit it, then let a scheduled agent improve it every few days — pull requests when the site lives in a Git repository, ready-to-paste recommendations in Google Slides when it runs on a CMS, and one-shot audits of any site delivered as an Excel workbook. Every action is tracked on a GitHub board or a shared Google Sheet, owners get a weekly email of what waits for them, and labeling an issue claude:fix gets it fixed in a pull request.",
  "tags": [
    "audit",
    "automation",
    "content",
    "excel",
    "github-issues",
    "google-trends",
    "pagespeed",
    "saas",
    "search-console",
    "seo"
  ],
  "skills": [
    "skf-seo-profile",
    "skf-seo-setup",
    "skf-seo-audit",
    "skf-seo-pass",
    "skf-github-issue-brief",
    "skf-github-issue-fix"
  ],
  "ordered": true
}
